title,artist,filename,genre
Drop of Rain,Tweeterfriendly Music,Tweeterfriendly Music - Drop of Rain.mp3,"post-hardcore, screamo, emo, hardcore, punk revival"
I Didn't Mean To,Casual,Casual - I Didn't Mean To.mp3,"hip hop, underground rap, g funk, alternative rap, gothic rock"
Amor de Cabaret (with Río Roma),La Sonora Santanera,La Sonora Santanera - Amor de Cabaret (with Río Roma).mp3,"salsa, cumbia, tejano, ranchera, latin pop"
Soul Deep,Alex Chilton formerly of The Box Tops,Alex Chilton formerly of The Box Tops - Soul Deep.mp3,"blue-eyed soul, pop rock, blues-rock, beach music, soft rock"
Something Girls (Album Version),Adam Ant,Adam Ant - Something Girls (Album Version).mp3,"pop rock, new wave, dance rock, rock, new romantic"
Face the Ashes,Gob,Gob - Face the Ashes.mp3,"pop punk, ska punk, breakcore, alternative metal, punk pop"
Keepin It Real (Skit),Rated R,Rated R - Keepin It Real (Skit).mp3,"breakbeat, dirty south rap, hip hop, electronic, trance"
The Moon And I (Ordinary Day Album Version),Jeff & Sheri Easter,Jeff & Sheri Easter - The Moon And I (Ordinary Day Album Version).mp3,"southern gospel, bluegrass, gospel, ballad, california"
Pink World,Planet P Project,Planet P Project - Pink World.mp3,"new wave, progressive rock, space rock, eurodance, hard rock"
Young Boy Blues #2,JennyAnyKind,JennyAnyKind - Young Boy Blues #2.mp3,"alternative rock, indie rock, rock, alternative pop rock, alternative"
Auguri Cha Cha,Bob Azzam,Bob Azzam - Auguri Cha Cha.mp3,"chanson, latin jazz, soul jazz, soft rock, jazz funk"
La Culpa.,Andy Andy,Andy Andy - La Culpa..mp3,"bachata, merengue, reggaeton, latin pop, spanish"
Tonight Will Be Alright,Lionel Richie,Lionel Richie - Tonight Will Be Alright.mp3,"quiet storm, soft rock, pop, urban, adult contemporary"
Insatiable,CLP,CLP - Insatiable.mp3,"breakcore, miami bass, new rave, grime, breakbeat"
The Urgency,Wayne Watson,Wayne Watson - The Urgency.mp3,"ccm, religious music, los angeles, christian rock, pop"
Floating (2012 Remaster),Blue Rodeo,Blue Rodeo - Floating (2012 Remaster).mp3,"country rock, heartland rock, pop rock, folk rock, psychedelic rock"
High Tide,Richard Souther,Richard Souther - High Tide.mp3,"chill-out, smooth jazz, orchestra, jazz, celtic"
Caught In A Dream (Album Version),Tesla,Tesla - Caught In A Dream (Album Version).mp3,"hard rock, heavy metal, blues-rock, classic rock, garage rock"
Broken Down Merry-Go-Round,Jimmy Wakely,Jimmy Wakely - Broken Down Merry-Go-Round.mp3,"classic country, western swing, blues-rock, country music, blues"
Kassie Jones,Alice Stuart,Alice Stuart - Kassie Jones.mp3,"electric blues, blues, country blues, blues-rock, folk rock"
Setting Fire to Sleeping Giants,The Dillinger Escape Plan,The Dillinger Escape Plan - Setting Fire to Sleeping Giants.mp3,"math-core, grindcore, hardcore punk, tech metal, punk metal"
Setanta matins,Élena,Élena - Setanta matins.mp3,"uk garage, pop folk, jazz fusion, chalga, jazz"
James (Hold the Ladder Steady),Sue Thompson,Sue Thompson - James (Hold the Ladder Steady).mp3,"pop rock, soft rock, blues-rock, doo-wop, chanson"
Superconfidential (Nic Sarno remix),CLP,CLP - Superconfidential (Nic Sarno remix).mp3,"breakcore, miami bass, new rave, grime, breakbeat"
I Think My Wife Is Running Around On Me (Taco Hell),Tim Wilson,Tim Wilson - I Think My Wife Is Running Around On Me (Taco Hell).mp3,"filk, comedy, spoken word, country, funny"
Made Like This,Five.Bolt.Main,Five.Bolt.Main - Made Like This.mp3,"post-grunge, alternative metal, nu metal, hard rock, alternative rock"
Crazy Mixed Up World,Faye Adams,Faye Adams - Crazy Mixed Up World.mp3,"jump blues, east coast blues, piano blues, blues, r&b"
Spanish Grease,Willie Bobo,Willie Bobo - Spanish Grease.mp3,"latin jazz, jazz funk, boogaloo, soul jazz, salsa"
Do You Finally Need A Friend,Terry Callier,Terry Callier - Do You Finally Need A Friend.mp3,"soul jazz, future jazz, smooth jazz, acid jazz, jazz funk"
The Emperor Falls,John Wesley,John Wesley - The Emperor Falls.mp3,"disco, calypso, reggae, hard trance, dub"
Twist And Shout,The Shangri-Las,The Shangri-Las - Twist And Shout.mp3,"doo-wop, ballad, pop rock, rock steady, soft rock"
It Makes No Difference Now,Billie Jo Spears,Billie Jo Spears - It Makes No Difference Now.mp3,"classic country, motown, oldies, rockabilly, traditional country"
¿Dónde Va Chichi?,Sierra Maestra,Sierra Maestra - ¿Dónde Va Chichi_.mp3,"charanga, salsa, latin jazz, rumba, bolero"
Oute Ena Efharisto,Despina Vandi,Despina Vandi - Oute Ena Efharisto.mp3,"dance pop, british pop, modern laika, eurodance, club"
In a Subtle Way,Jacob Young,Jacob Young - In a Subtle Way.mp3,"cool jazz, free jazz, soul jazz, country rock, jazz"
Spin,Scarlet's Remains,Scarlet's Remains - Spin.mp3,"gothic metal, deathrock, horror punk, neofolk, gothic rock"
"Laws Patrolling (Screwed & Chopped) [feat. CJ, Mello & Lil' Bran] [DJ Michael Watts Remix]",Mike Jones,"Mike Jones - Laws Patrolling (Screwed & Chopped) [feat. CJ, Mello & Lil' Bran] [DJ Michael Watts Remix].mp3","rap, hip hop, classic, hardcore rap, southern rap"
Burning In The Aftermath,The Suicide Machines,The Suicide Machines - Burning In The Aftermath.mp3,"ska punk, post-grunge, skacore, ska, skate punk"
Sabor Guajiro,Roberto Torres,Roberto Torres - Sabor Guajiro.mp3,"salsa, charanga, vallenato, latin jazz, samba"
Human Cannonball,Loudon Wainwright III,Loudon Wainwright III - Human Cannonball.mp3,"modern rock, singer-songwriter, folk, rock, vocal"
Angie (Remastered 2005),The Rolling Stones,The Rolling Stones - Angie (Remastered 2005).mp3,"blues, hard rock, rock, england, london"
Glory Be,R.L. Burnside,R.L. Burnside - Glory Be.mp3,"delta blues, blues-rock, electric blues, blues, juke joint blues"
Crossfire,Stevie Ray Vaughan & Double Trouble,Stevie Ray Vaughan & Double Trouble - Crossfire.mp3,"texas blues, blues, blues-rock, modern electric blues, rock"
"I Can't Be Satisfied (Live at the Boarding House, 6/2/1973)",John Hammond,"John Hammond - I Can't Be Satisfied (Live at the Boarding House, 6_2_1973).mp3","blues, blues-rock, motown, chicago blues, rockabilly"
Nashville Parthenon (instrumental),Casiotone for the Painfully Alone,Casiotone for the Painfully Alone - Nashville Parthenon (instrumental).mp3,"trip hop, indietronica, electro, neofolk, indie rock"
Cocain Ducks,Ec8or,Ec8or - Cocain Ducks.mp3,"hardcore techno, digital hardcore, breakcore, industrial metal, gabba"
"Human Being (Recorded at Blue Rock Studio, NYC, June 1972)",The New York Dolls,"The New York Dolls - Human Being (Recorded at Blue Rock Studio, NYC, June 1972).mp3","glam rock, hard rock, protopunk, rock 'n roll, blues-rock"
The More I See You,Eliane Elias,Eliane Elias - The More I See You.mp3,"brazilian jazz, latin jazz, hard bop, jazz funk, vocal jazz"
Certain Things We Do (Album Version Edited),Lost Boyz,Lost Boyz - Certain Things We Do (Album Version Edited).mp3,"gangster rap, g funk, hip hop, east coast hip hop, rap"
Forming (Live),The Germs,The Germs - Forming (Live).mp3,"rock, punk, los angeles, grunge, southern rock"
Mafuá,Yamandu Costa,Yamandu Costa - Mafuá.mp3,"brazilian jazz, brazilian pop music, choro, jazz, brazilian"
Driving Home for Christmas,Chris Rea,Chris Rea - Driving Home for Christmas.mp3,"soft rock, blues-rock, pop rock, country rock, singer-songwriter"
Spooks In Space,Perrey And Kingsley,Perrey And Kingsley - Spooks In Space.mp3,"easy listening, jazz funk, space age pop, big beat, electronic"
Tous Les Garçons Et Les Filles (Remastered Version),Eurythmics,Eurythmics - Tous Les Garçons Et Les Filles (Remastered Version).mp3,"dance rock, new wave, synthpop, rock, pop"
Too Much Saturn,Francis Dunnery,Francis Dunnery - Too Much Saturn.mp3,"singer-songwriter, art rock, soundtrack, progressive rock, pop rock"
Stream,Suzanne Ciani,Suzanne Ciani - Stream.mp3,"meditation, chill-out, downtempo, new age, easy listening"
Make Me Over,Vickie Winans,Vickie Winans - Make Me Over.mp3,"ccm, soul jazz, hip hop, italian disco, trip hop"
Movement 4 [from Kiss],John Cale,John Cale - Movement 4 [from Kiss].mp3,"experimental rock, art rock, experimental, alternative, indie"
Wicker Chair,Kings Of Leon,Kings Of Leon - Wicker Chair.mp3,"southern rock, alternative rock, rock, nashville, american trad rock"
An ti chans' (Remastered 2024),Edith Lefel,Edith Lefel - An ti chans' (Remastered 2024).mp3,"zouk, merengue, kizomba, zouklove, reggae"
Deform (Live),The Berzerker,The Berzerker - Deform (Live).mp3,"speedcore, grindcore, gabba, death metal, breakcore"
I Will Love Again (JJ's Club Radio),TARAS,TARAS - I Will Love Again (JJ's Club Radio).mp3,"trance, electronic, dance, house, techno"
Stickin in My Eye (Live),NOFX,NOFX - Stickin in My Eye (Live).mp3,"punk, rock, alternative punk rock, punk pop, skate punk"
Ota kiinni,Murskahumppa,Murskahumppa - Ota kiinni.mp3,"suomi rock, humppa, hardcore punk, finish, punk"
Entre Caníbales,Soda Stereo,Soda Stereo - Entre Caníbales.mp3,"rock, latin pop, ska, reggae, rap"
Rosemary Recalls,Bruce Rowland,Bruce Rowland - Rosemary Recalls.mp3,"easy listening, chill-out, soundtrack, orchestra, classical"
Sudanese Dance,Xcultures,Xcultures - Sudanese Dance.mp3,"gabba, happy hardcore, world beat, chill-out, disco"
Wanna Be A Player (Album Version),Heavy D,Heavy D - Wanna Be A Player (Album Version).mp3,"pop rap, hip hop, new jack swing, broken beat, europop"
Let's Get It Started,The Black Eyed Peas,The Black Eyed Peas - Let's Get It Started.mp3,"hip hop, rap, funk, r&b, pop"
Metal (Remix),Nine Inch Nails,Nine Inch Nails - Metal (Remix).mp3,"industrial metal, alternative metal, industrial rock, alternative rock, rock"
Panama,Van Halen,Van Halen - Panama.mp3,"heavy metal, hard rock, rock, album rock, soundtrack"
Next Time,Nadine Renee,Nadine Renee - Next Time.mp3,"freestyle, disco, hard house, dance pop, progressive trance"
Complicate It,Smartbomb,Smartbomb - Complicate It.mp3,"melodic hardcore, post-grunge, hardcore punk, punk, hardcore"
She Fell Away (Remastered 2009),Nick Cave & The Bad Seeds,Nick Cave & The Bad Seeds - She Fell Away (Remastered 2009).mp3,"rock, alternative, soundtrack, guitar, piano"
It's My Party (Rerecorded),Lesley Gore,Lesley Gore - It's My Party (Rerecorded).mp3,"brill building pop, oldies, ballad, soft rock, motown"
I'm Gone This Time,Glen Campbell,Glen Campbell - I'm Gone This Time.mp3,"country rock, soft rock, pop rock, folk rock, ballad"
You Feel Good All Over (Rerecorded),T.G. Sheppard,T.G. Sheppard - You Feel Good All Over (Rerecorded).mp3,"country rock, rock, country, country pop, folk"
Indian Love Call,Slim Whitman,Slim Whitman - Indian Love Call.mp3,"folk-pop, country rock, pop rock, classic country, ballad"
This Melody (Live),Julien Clerc,Julien Clerc - This Melody (Live).mp3,"chanson, ballad, pop, disco, blues-rock"
Commercial Reign,Inspiral Carpets,Inspiral Carpets - Commercial Reign.mp3,"indie rock, psychedelic rock, madchester, dance rock, rock"
Dixie,Hank Penny and The Lincoln Penny Orchestra,Hank Penny and The Lincoln Penny Orchestra - Dixie.mp3,"western swing, classic country, jazz, country, folk"
I Never Came (Album Version),Queens Of The Stone Age,Queens Of The Stone Age - I Never Came (Album Version).mp3,"stoner metal, alternative metal, heavy metal, hard rock, rock"
You Can Still Be Free,Savage Garden,Savage Garden - You Can Still Be Free.mp3,"easy listening, pop, rock, adult contemporary, ballad"
Hourglass (Edited),Borialis,Borialis - Hourglass (Edited).mp3,"rap rock, rapcore, funk metal, nu metal, hip hop"
Wake,The Dirty Skirts,The Dirty Skirts - Wake.mp3,"indie rock, singer-songwriter, indie, sxsw 2007, south african"
Caricia y herida,Flor Silvestre,Flor Silvestre - Caricia y herida.mp3,"ranchera, mexico, los angeles, folk, latin"
Le Tortillard,Bézu,Bézu - Le Tortillard.mp3,"chanson, bossa nova, black metal, pop, electronic"
WKYA (Drop),Redman,Redman - WKYA (Drop).mp3,"hip hop, rap, hardcore rap, east coast rap, funk"
Teräslintu,Solistiyhtye Suomi,Solistiyhtye Suomi - Teräslintu.mp3,"german pop, humppa, polka, patriotic, folk"
Now's The Time To Fall In Love,The Eddie Cantor Radio Show,The Eddie Cantor Radio Show - Now's The Time To Fall In Love.mp3,"easy listening, vaudeville, ragtime, jazz, world music"
Mangos,Kai Winding,Kai Winding - Mangos.mp3,"hard bop, bebop, latin jazz, jazz, funk"
Grim Prospects,Schizoid,Schizoid - Grim Prospects.mp3,"breakcore, grindcore, breakbeat, digital hardcore, gabba"
A Distant Voice,Sonny Simmons,Sonny Simmons - A Distant Voice.mp3,"free jazz, jazz, los angeles, free music, free improvisation"
President Johnson,Citizen Kaned,Citizen Kaned - President Johnson.mp3,"chill-out, dub, progressive trance, downtempo, electronic"
Openbare Weg,MIRA,MIRA - Openbare Weg.mp3,"shoegaze, dream pop, rock, dark wave, slow core"
Lead Me Lord,The Brooklyn Tabernacle Choir,The Brooklyn Tabernacle Choir - Lead Me Lord.mp3,"gospel, black gospel, contemporary gospel, contemporary christian, christian"
Spontanous Combustion,Ellen McIlwaine,Ellen McIlwaine - Spontanous Combustion.mp3,"blues-rock, jazz funk, latin jazz, country blues, future jazz"
Choro (Remastered 2026),Vince Guaraldi,Vince Guaraldi - Choro (Remastered 2026).mp3,"latin jazz, chamber jazz, soul jazz, jazz funk, jazz fusion"
Ma Louise,Maurice Chevalier,Maurice Chevalier - Ma Louise.mp3,"chanson, latin jazz, cabaret, ballad, jazz"
I Want You (Forever) (DJ Marky & a Sides Remix),Carl Cox,Carl Cox - I Want You (Forever) (DJ Marky & a Sides Remix).mp3,"tech house, progressive house, techno, electronica, acid house"
Hate,Organized Konfusion,Organized Konfusion - Hate.mp3,"hip hop, chill-out, east coast hip hop, jazz rap, trip hop"
Thank You Lord,Horace Andy,Horace Andy - Thank You Lord.mp3,"roots reggae, lovers rock, dub, reggae, trip hop"
I Can't Stop Loving You,Martina McBride,Martina McBride - I Can't Stop Loving You.mp3,"country, country music, pop, acoustic, contemporary country"
Cheatin' In the Next Room,Tyrone Davis,Tyrone Davis - Cheatin' In the Next Room.mp3,"chicago soul, disco, southern soul, funk, northern soul"
Candy Man,Hot Tuna,Hot Tuna - Candy Man.mp3,"blues-rock, blues, folk rock, psychedelic rock, rock"
I See The Boys Of Summer,Richard Burton,Richard Burton - I See The Boys Of Summer.mp3,"jazz fusion, jam band, improvisational, jazz, synthpop"
On Bended Knee,Boyz II Men,Boyz II Men - On Bended Knee.mp3,"new jack swing, urban, soul, adult contemporary, ballad"
Three Is a Crowd,Rory Block,Rory Block - Three Is a Crowd.mp3,"delta blues, blues, ballad, country blues, folk rock"
My Four Reasons,Howard Armstrong,Howard Armstrong - My Four Reasons.mp3,"piedmont blues, country blues, blues, folk, tin pan alley"
Niev nietch nievitch (Instrumental),Les Ogres de Barback,Les Ogres de Barback - Niev nietch nievitch (Instrumental).mp3,"chanson, gypsy jazz, chill-out, musette, ska"
Little Girl,Donny Hathaway,Donny Hathaway - Little Girl.mp3,"jazz funk, soul jazz, bossa nova, funk, chicago soul"
White Feather,Wolfmother,Wolfmother - White Feather.mp3,"stoner metal, alternative metal, heavy metal, hard rock, rock"
Christlike Roche,The Roches,The Roches - Christlike Roche.mp3,"singer-songwriter, folk-pop, close harmony, folk rock, contemporary folk"
You Rascal You,Bob Margolin,Bob Margolin - You Rascal You.mp3,"blues-rock, chicago blues, massachusetts, blues, classic rock"
I Want Love (Tween You & Me),Tony Joe White,Tony Joe White - I Want Love (Tween You & Me).mp3,"country rock, blues-rock, swamp pop, southern rock, outlaw country"
Sympathy,Thomas Battenstein,Thomas Battenstein - Sympathy.mp3,guitar
Simon's Folly,Dharma Bums,Dharma Bums - Simon's Folly.mp3,"progressive house, breakbeat, hard trance, techno, trance"
They Say,Jupiter Rising,Jupiter Rising - They Say.mp3,"pop rap, electropop, hip hop, downtempo, urban"
Biding Her Time,Bob Neuwirth,Bob Neuwirth - Biding Her Time.mp3,"singer-songwriter, oldies, blues, world fusion, folk"
Cowboy Ways,James Hunter,James Hunter - Cowboy Ways.mp3,"blue-eyed soul, jazz funk, smooth jazz, blues-rock, r&b"
Crawl Before You Ball,Saafir,Saafir - Crawl Before You Ball.mp3,"hip hop, hardcore hip hop, rap, underground hip hop, underground rap"
Brasas Vivas,Nelson Ned,Nelson Ned - Brasas Vivas.mp3,"latin jazz, mariachi, brazilian pop music, karaoke, thrash metal"
More and More,Marvin Sapp,Marvin Sapp - More and More.mp3,"gospel, male vocalist, r&b, christian, urban"
Groovin' In The Midnight (Morales Extended Version),Maxi Priest,Maxi Priest - Groovin' In The Midnight (Morales Extended Version).mp3,"lovers rock, pop rap, reggae, hip hop, dancehall"
Waiting Phase One,Porcupine Tree,Porcupine Tree - Waiting Phase One.mp3,"experimental rock, art rock, post rock, experimental, ambient"
Hell,Foo Fighters,Foo Fighters - Hell.mp3,"grunge, alternative rock, hard rock, rock, seattle"
Juoksuhauta-twist (Elämä juoksuhaudoissa),The Avengers,The Avengers - Juoksuhauta-twist (Elämä juoksuhaudoissa).mp3,"rock, garage rock, punk, new wave, hardcore punk"
One Less Bell to Answer,Brazilian Tropical Orchestra,Brazilian Tropical Orchestra - One Less Bell to Answer.mp3,"bossa nova, orchestra, latin jazz, easy listening, disco"
A'chek Ouyounik (2009 Remaster),Ragheb Alama,Ragheb Alama - A'chek Ouyounik (2009 Remaster).mp3,"arabesque, flamenco, samba, deep house, disco"
Hips Don't Lie (feat. Wyclef Jean),Shakira,Shakira - Hips Don't Lie (feat. Wyclef Jean).mp3,"dance pop, pop, latin, urban, adult contemporary"
Festa,Gil Semedo,Gil Semedo - Festa.mp3,"zouk, kizomba, island music, zouklove, r&b"
I Got over It,Robben Ford,Robben Ford - I Got over It.mp3,"blues-rock, jazz blues, soul blues, latin jazz, blues"
Te Hacen Falta Vitaminas (En Vivo),Soda Stereo,Soda Stereo - Te Hacen Falta Vitaminas (En Vivo).mp3,"rock, latin pop, ska, reggae, rap"
Sense And Trick,Xmilk,Xmilk - Sense And Trick.mp3,"thrash core, hardcore punk, punk, hardcore, old school"
Hanging On (Medium Key Performance Track Without Background Vocals),Britt Nicole,Britt Nicole - Hanging On (Medium Key Performance Track Without Background Vocals).mp3,"ccm, pop rock, soft rock, christian music, grindcore"
Fire (Oscar G Space Vocal),Dolce,Dolce - Fire (Oscar G Space Vocal).mp3,"folk-pop, folk, female vocalist, rock, acoustic"
2190 Dias Contigo,Sven Tasnadi,Sven Tasnadi - 2190 Dias Contigo.mp3,"tech house, deep house, techno, broken beat, italian disco"
Gossippo Perpetuo,Perrey And Kingsley,Perrey And Kingsley - Gossippo Perpetuo.mp3,"easy listening, dubstep, jazz funk, big beat, space age pop"
Grim Prospects,Schizoid,Schizoid - Grim Prospects [TRAAKXN128F92E71B1].mp3,"breakcore, grindcore, breakbeat, digital hardcore, gabba"
No Control,Eddie Money,Eddie Money - No Control.mp3,"frevo, samba, banda, rockabilly, bossa nova"
Christmas In Jamaica (feat. Shaggy) (Remix),Toni Braxton,Toni Braxton - Christmas In Jamaica (feat. Shaggy) (Remix).mp3,"dance pop, rock, urban, adult contemporary, club"
The Vitalized Shell,Enthroned,Enthroned - The Vitalized Shell.mp3,"black metal, heavy metal, rock, blackened death metal, extreme metal"
Mozart,Suzanne Ciani,Suzanne Ciani - Mozart.mp3,"meditation, chill-out, downtempo, new age, easy listening"
Ciao Milan,Milan Band,Milan Band - Ciao Milan.mp3,"serialism, contemporary classical music, minimal"
Heaven Is Where The Heart Is,The Rance Allen Group,The Rance Allen Group - Heaven Is Where The Heart Is.mp3,"jazz funk, soul jazz, funk, disco, latin jazz"
Letter To Heaven,Dolly Parton,Dolly Parton - Letter To Heaven.mp3,"bluegrass, singer-songwriter, female vocalist, country, pop"
Inside Job (Live),Pearl Jam,Pearl Jam - Inside Job (Live).mp3,"grunge, hard rock, rock, alternative rock, alternative"
Take A Look,Natalie Cole,Natalie Cole - Take A Look.mp3,"vocal jazz, quiet storm, jazz, pop, rock"
Bulgarian dream feat. Boika Prissadova,Kiril Valeri,Kiril Valeri - Bulgarian dream feat. Boika Prissadova.mp3,"flamenco, rumba, ska punk, folk rock, pop rock"
The Czar: Usurper / Escape / Martyr / Spiral (Live at the Aragon),Mastodon,Mastodon - The Czar_ Usurper _ Escape _ Martyr _ Spiral (Live at the Aragon).mp3,"alternative metal, power metal, post-hardcore, progressive metal, heavy metal"
Born and Raised In Compton,DJ Quik,DJ Quik - Born and Raised In Compton.mp3,"gangster rap, hip hop, g funk, broken beat, trip hop"
We're Gonna Go Fishin',Hank Locklin,Hank Locklin - We're Gonna Go Fishin'.mp3,"honky tonk, country rock, ballad, chanson, classic country"
Robbers Kill Cop,BT,BT - Robbers Kill Cop.mp3,"electronica, rock, ambient, alternative, club"
Orgofart,Descendents,Descendents - Orgofart.mp3,"hardcore punk, rock, punk, progressive, los angeles"
Bitch Is Back,L.A. Guns,L.A. Guns - Bitch Is Back.mp3,"heavy metal, hard rock, glam rock, glam metal, rock"
Relax (Neitan Radio Mix),2-4 Grooves,2-4 Grooves - Relax (Neitan Radio Mix).mp3,"vocal house, disco house, club, eurodance, electro"
Sweet By And By,The Jordanaires,The Jordanaires - Sweet By And By.mp3,"country gospel, classic country, rockabilly, oldies, christmas music"
Naked Albino,Bare JR.,Bare JR. - Naked Albino.mp3,"post-grunge, alternative country, hard rock, male vocalist, alternative rock"
Dearly Beloved,Norrie Paramor,Norrie Paramor - Dearly Beloved.mp3,"easy listening, pop, classical, jazz, rock"
Johnny Loves Me,Shelley Fabares,Shelley Fabares - Johnny Loves Me.mp3,"brill building pop, all-female, pop rock, country rock, blue-eyed soul"
Cooler Than You,Diesel Boy,Diesel Boy - Cooler Than You.mp3,"pop rock, pop punk, rock, punk, skate punk"
Still,Jim Chappell,Jim Chappell - Still.mp3,"chamber jazz, smooth jazz, chill-out, new age, easy listening"
Summer Dying Fast,Cradle Of Filth,Cradle Of Filth - Summer Dying Fast.mp3,"sympho black metal, black metal, heavy metal, death metal, metal"
Snapshot (Robin M. Extended Remix),Ladybug,Ladybug - Snapshot (Robin M. Extended Remix).mp3,"dancehall, italian disco, dubstep, breakbeat, dub"
The Frail,Nine Inch Nails,Nine Inch Nails - The Frail.mp3,"industrial metal, alternative metal, industrial rock, alternative rock, rock"
End of the Road (Original Mix),Bandido,Bandido - End of the Road (Original Mix).mp3,"hard house, hard trance, italian disco, eurodance, breakbeat"
Para Milladoiro,Susana Seivane,Susana Seivane - Para Milladoiro.mp3,"gaita, celtic, folk, traditional, instrumental"
Stone Cold Fingers (Bonus Track),Leland Martin,Leland Martin - Stone Cold Fingers (Bonus Track).mp3,"honky tonk, massachusetts, country, traditional country, electronic"
Snowball,Test Icicles,Test Icicles - Snowball.mp3,"grime, indie rock, garage rock, dance-punk, electro"
(We Don't Need This) Fascist Groove Thang (Rapino Club Mix),Heaven 17,Heaven 17 - (We Don't Need This) Fascist Groove Thang (Rapino Club Mix).mp3,"new romantic, dance rock, italian disco, new wave, electronic"
Charisma Remixed,Sven Tasnadi,Sven Tasnadi - Charisma Remixed.mp3,"tech house, deep house, techno, broken beat, italian disco"
Going Down Slow (Live),Mance Lipscomb,Mance Lipscomb - Going Down Slow (Live).mp3,"texas blues, country blues, blues, delta blues, blues-rock"
All Rise,Scott Wesley Brown,Scott Wesley Brown - All Rise.mp3,"modern rock, rock, inspirational, gospel, christian"
Jogo Limpo,Flávio José,Flávio José - Jogo Limpo.mp3,"brazil, forro, gaita, north east, world reggae"
Silent Hill,Moss,Moss - Silent Hill.mp3,"future jazz, trip hop, downtempo, acid jazz, drone doom metal"
Our Love is Here to Stay,Pery Ribeiro,Pery Ribeiro - Our Love is Here to Stay.mp3,"bossa nova, brazilian pop music, samba, latin, jazz"
Master of Disharmony,Dimmu Borgir,Dimmu Borgir - Master of Disharmony.mp3,"black metal, death metal, heavy metal, metal, extreme metal"
Everything Changes,Soular,Soular - Everything Changes.mp3,"breakbeat, broken beat, funk rock, post rock, shoegaze"
What Are We Here For,Gary Moore,Gary Moore - What Are We Here For.mp3,"blues-rock, hard rock, pop rock, soft rock, blues"
Une petite pause,PASCAL SANGLA,PASCAL SANGLA - Une petite pause.mp3,french pop
Perasmena Mesanihta,Dakis,Dakis - Perasmena Mesanihta.mp3,greek
This Is Not A Love Song (Remastered),Public Image Limited,Public Image Limited - This Is Not A Love Song (Remastered).mp3,"dance rock, alternative dance, experimental rock, noise rock, madchester"
Sun is Shining,Deekline & Wizard,Deekline & Wizard - Sun is Shining.mp3,"breakbeat, uk garage, electro, nu breaks, grime"
Forever,Chris Brown,Chris Brown - Forever.mp3,"r&b, hip hop, rap, urban, blues"
God Save the Queen (Live),Sex Pistols,Sex Pistols - God Save the Queen (Live).mp3,"punk, italy, british punk rock, soundtrack, progressive rock"
NEW AGE,Daniela Dessì,Daniela Dessì - NEW AGE.mp3,"opera, los angeles, requiem"
Have Yourself A Merry Little Christmas,Hem,Hem - Have Yourself A Merry Little Christmas.mp3,"folk-pop, easy listening, alternative country, countrypolitan, folk"
U Killed It,Lily Allen,Lily Allen - U Killed It.mp3,"ska, pop, england, london, electropop"
Gerra De De,DJ Dips,DJ Dips - Gerra De De.mp3,"turnablism, folk, dj"
Rain And Snow,Pentangle,Pentangle - Rain And Snow.mp3,"british invasion, chill-out, celtic rock, folk rock, celtic"
Voices on the Corner,Jason Miles,Jason Miles - Voices on the Corner.mp3,"jazz fusion, hard bop, smooth jazz, meditation, instrumental pop"
I Wish My Mother Was Here,Byther Smith,Byther Smith - I Wish My Mother Was Here.mp3,"chicago blues, electric blues, delta blues, blues-rock, blues"
(Bloody Paw on the) Kill Floor,Busdriver,Busdriver - (Bloody Paw on the) Kill Floor.mp3,"alternative hip hop, turnablism, underground rap, indie rock, trip hop"
Kako mi je pitas sad,Ana Bekuta,Ana Bekuta - Kako mi je pitas sad.mp3,"pop folk, turbo folk, disco, serbia, folk"
Miracle,Bizarre Inc,Bizarre Inc - Miracle.mp3,"breakbeat, pop rap, techno, deep house, progressive house"
Not Buried Deep Enough,The Gone Jackals,The Gone Jackals - Not Buried Deep Enough.mp3,"blues-rock, video game music, heavy metal, grindcore, hard rock"
